<?xml version="1.0" encoding="UTF-8"?>
<xs:schema xmlns:xs="http://www.w3.org/2001/XMLSchema" 
           elementFormDefault="qualified"
           targetNamespace="http://mokai.googlecode.com/receivers"
           xmlns:receivers="http://mokai.googlecode.com/receivers">

	<xs:element name="receivers">
		<xs:complexType>
			<xs:choice minOccurs="0" maxOccurs="unbounded">
                <xs:element ref="receivers:receiver"/>
            </xs:choice>
       </xs:complexType>
	</xs:element>
	
	<xs:element name="receiver">
		<xs:complexType>
			<xs:all>
        		<xs:element ref="receivers:configuration" minOccurs="0"/>
        		<xs:element ref="receivers:post-receiving-actions" minOccurs="0" />
        	</xs:all>
        	
        	<xs:attribute name="id" type="xs:string" use="required"/>
        	<xs:attribute name="className" type="xs:string" use="required" />
        	<xs:attribute name="type" type="xs:string" />
        </xs:complexType>
	</xs:element>
	
	<xs:element name="post-receiving-actions">
		<xs:complexType>
			<xs:choice minOccurs="0" maxOccurs="unbounded">
        		<xs:element ref="receivers:action" />
        	</xs:choice>
		</xs:complexType>
	</xs:element>
	
	<xs:element name="action">
		<xs:complexType>
			<xs:choice minOccurs="0" maxOccurs="unbounded">
				<xs:element ref="receivers:property"/>
				<xs:element ref="receivers:mapProperty"/>
				<xs:element ref="receivers:listProperty"/>
			</xs:choice>
		
			<xs:attribute name="className" type="xs:string" />
			<xs:attribute name="type" type="xs:string" />
		</xs:complexType>
	</xs:element>
	
	<xs:element name="configuration">
		<xs:complexType>
			<xs:choice minOccurs="0" maxOccurs="unbounded">
				<xs:element ref="receivers:property"/>
				<xs:element ref="receivers:mapProperty"/>
				<xs:element ref="receivers:listProperty"/>
			</xs:choice>
        </xs:complexType>
	</xs:element>
	
	<xs:element name="property">
		<xs:complexType>
			<xs:simpleContent>
				<xs:extension base="xs:string">
					<xs:attribute name="name" type="xs:string" use="required" />
					<xs:attribute name="value" type="xs:string" />
				</xs:extension>
			</xs:simpleContent>
			
		</xs:complexType>
	</xs:element>
	
	<xs:element name="mapProperty">
		<xs:complexType>
			<xs:choice minOccurs="0" maxOccurs="unbounded">
				<xs:element name="item">
					<xs:complexType>
						<xs:simpleContent>
							<xs:extension base="xs:string">
								<xs:attribute name="key" type="xs:string" use="required" />
								<xs:attribute name="value" type="xs:string" />
							</xs:extension>
						</xs:simpleContent>
					</xs:complexType>
				</xs:element>
			</xs:choice>
			
			<xs:attribute name="name" type="xs:string" use="required" />
		</xs:complexType>
	</xs:element>
	
	<xs:element name="listProperty">
		<xs:complexType>
			<xs:choice minOccurs="0" maxOccurs="unbounded">
				<xs:element name="item">
				<xs:complexType>
					<xs:simpleContent>
						<xs:extension base="xs:string">
							<xs:attribute name="value" type="xs:string" />
						</xs:extension>
					</xs:simpleContent>
				</xs:complexType>
			</xs:element>
			</xs:choice>
			
			<xs:attribute name="name" type="xs:string" use="required" />
		</xs:complexType>
	</xs:element>
	
</xs:schema>